{
  "$schema": "https://json-schema.org/draft/2020-12/schema",
  "$id": "https://reply.local/contracts/v1/po-dev-handoff.schema.json",
  "title": "PoDevHandoff",
  "type": "object",
  "additionalProperties": false,
  "required": ["contract_version", "run_id", "story", "backlog_hash", "story_hash", "po_instructions_hash"],
  "properties": {
    "contract_version": {"$ref": "https://reply.local/contracts/v1/common.schema.json#/$defs/contractVersion"},
    "run_id": {"$ref": "https://reply.local/contracts/v1/common.schema.json#/$defs/uuid"},
    "story": {"$ref": "https://reply.local/contracts/v1/po-output.schema.json#/$defs/story"},
    "backlog_hash": {"$ref": "https://reply.local/contracts/v1/common.schema.json#/$defs/sha256"},
    "story_hash": {"$ref": "https://reply.local/contracts/v1/common.schema.json#/$defs/sha256"},
    "po_instructions_hash": {"$ref": "https://reply.local/contracts/v1/common.schema.json#/$defs/sha256"}
  }
}
