{"contract_version":"1.0.0","run_id":"11111111-1111-4111-8111-111111111111","story":{"story_id":"STORY-001","title":"Criar reserva","narrative":"Como colaborador, quero reservar uma sala para organizar uma reunião.","priority":"MUST","depends_on":[],"acceptance_criteria":[{"criterion_id":"AC-001","order":1,"description":"A reserva válida é persistida.","verification":"Consultar a reserva pela API retorna os mesmos dados."}],"ready":true},"backlog_hash":"sha256:bbbbbbbbbbbbbbbbbbbbbbbbbbbbbbbbbbbbbbbbbbbbbbbbbbbbbbbbbbbbbbbb","story_hash":"sha256:cccccccccccccccccccccccccccccccccccccccccccccccccccccccccccccccc","po_instructions_hash":"sha256:dddddddddddddddddddddddddddddddddddddddddddddddddddddddddddddddd"}
